[
  {
    "company_name": "CPR Cell Phone Repair",
    "country": "United States",
    "city": "Nationwide / multiple locations",
    "business_type": "reparacion_celulares_consolas",
    "language": "en",
    "website": "https://www.cellphonerepair.com/locations/usa",
    "email": "",
    "email_verification": "not_published",
    "financing_status": "not_financing",
    "source": "https://www.cellphonerepair.com/locations/usa",
    "source_date": "2026-10-14",
    "score": 85,
    "status": "new",
    "intent_status": "medium",
    "need_signal": "Phone and game-console repair network",
    "need_evidence": "Official US locations page lists smartphone, computer and gaming-console repairs and says stores are independently owned and operated.",
    "commercial_angle": "Qualify independently operated locations that also sell financed devices.",
    "notes": "No public email confirmed; enrich before outreach."
  },
  {
    "company_name": "uBreakiFix by Asurion",
    "country": "United States",
    "city": "Nationwide / multiple locations",
    "business_type": "reparacion_celulares_consolas",
    "language": "en",
    "website": "https://www.ubreakifix.com/help/contact",
    "email": "support@ubreakifix.com",
    "email_verification": "published_public",
    "email_source": "https://www.ubreakifix.com/help/contact",
    "financing_status": "not_financing",
    "source": "https://www.ubreakifix.com/help/contact",
    "source_date": "2026-10-14",
    "score": 85,
    "status": "new",
    "intent_status": "medium",
    "need_signal": "National electronics repair network",
    "need_evidence": "Official contact page publishes support@ubreakifix.com and describes device repair services.",
    "commercial_angle": "Ask about franchise/store-level opportunities and device sales on installments.",
    "notes": "Public email; deliverability untested. Support may not be the right sales contact."
  },
  {
    "company_name": "Cellairis",
    "country": "United States",
    "city": "Alpharetta, Georgia / multiple locations",
    "business_type": "reparacion_celulares_consolas",
    "language": "en",
    "website": "https://www.cellairis.com/contact-us",
    "email": "sales@cellairis.com",
    "email_verification": "published_public",
    "email_source": "https://www.cellairis.com/contact-us",
    "financing_status": "not_financing",
    "source": "https://www.cellairis.com/contact-us",
    "source_date": "2026-10-14",
    "score": 100,
    "status": "new",
    "intent_status": "medium",
    "need_signal": "Phone repair, accessories and franchise operations",
    "need_evidence": "Official contact page lists franchising, business development and wholesale inquiries; publishes sales@cellairis.com.",
    "commercial_angle": "Qualify stores that sell devices and may need installment tracking.",
    "notes": "Public sales email; deliverability untested."
  },
  {
    "company_name": "United Smart Tech",
    "country": "United States",
    "city": "United States / franchise network",
    "business_type": "reparacion_celulares_consolas",
    "language": "en",
    "website": "https://www.unitedsmarttech.com/support/",
    "email": "partnerships@unitedsmarttech.com",
    "email_verification": "published_public",
    "email_source": "https://www.unitedsmarttech.com/support/",
    "financing_status": "not_financing",
    "source": "https://www.unitedsmarttech.com/support/",
    "source_date": "2026-10-14",
    "score": 100,
    "status": "new",
    "intent_status": "medium",
    "need_signal": "Repair franchise partnerships",
    "need_evidence": "Official page lists partnerships@unitedsmarttech.com for partnerships and franchise operations.",
    "commercial_angle": "Explore a partnership pilot for repair retailers that also sell devices.",
    "notes": "Public partnerships email; financing sales not yet verified."
  },
  {
    "company_name": "iFixandRepair — Teaticket location",
    "country": "United States",
    "city": "Teaticket, Massachusetts",
    "business_type": "reparacion_celulares_consolas",
    "language": "en",
    "website": "https://ifixandrepair.com/pages/teaticket-wm",
    "email": "teaticket@ifixandrepair.com",
    "email_verification": "published_public",
    "email_source": "https://ifixandrepair.com/pages/teaticket-wm",
    "financing_status": "not_financing",
    "source": "https://ifixandrepair.com/pages/teaticket-wm",
    "source_date": "2026-10-14",
    "score": 85,
    "status": "new",
    "intent_status": "medium",
    "need_signal": "Local smartphone and tablet repair location",
    "need_evidence": "Official location page publishes the store email and describes smartphone repairs.",
    "commercial_angle": "Qualify whether the location sells devices on credit and needs store-level workflows.",
    "notes": "Email is for the local store, not corporate sales; deliverability untested."
  },
  {
    "company_name": "AH Appliances & More",
    "country": "United States",
    "city": "Gainesville and Marietta, Georgia",
    "business_type": "tienda_electrodomesticos_financia",
    "language": "en",
    "website": "https://ah-appliances.com/financing",
    "email": "ahappliances1@gmail.com",
    "email_verification": "published_public",
    "email_source": "https://ah-appliances.com/financing",
    "financing_status": "verified",
    "financing_evidence": "Official financing page lists lease-to-own partners and in-store layaway installments over 90 days.",
    "source": "https://ah-appliances.com/financing",
    "source_date": "2026-10-14",
    "financing_method": "Lease-to-own and 90-day layaway",
    "store_count": 2,
    "score": 100,
    "status": "new",
    "intent_status": "high",
    "need_signal": "Appliance retailer with financing and installments",
    "need_evidence": "Official financing page lists financing partners and a 90-day layaway plan.",
    "commercial_angle": "Offer credit-sale tracking, due dates, balances and multi-location oversight.",
    "notes": "Public email; delivery and decision-maker identity unverified."
  },
  {
    "company_name": "Drimmers Appliances",
    "country": "United States",
    "city": "Miami Beach, Florida",
    "business_type": "tienda_electrodomesticos_financia",
    "language": "en",
    "website": "https://www.drimmersusa.com/payment-options/",
    "email": "orders@drimmersUSA.com",
    "email_verification": "published_public",
    "email_source": "https://www.drimmersusa.com/payment-options/",
    "financing_status": "verified",
    "financing_evidence": "Official payment options page describes Synchrony financing with six- and twelve-month plans subject to eligibility.",
    "source": "https://www.drimmersusa.com/payment-options/",
    "source_date": "2026-10-14",
    "financing_method": "Synchrony financing",
    "store_count": 1,
    "score": 85,
    "status": "new",
    "intent_status": "high",
    "need_signal": "Appliance retailer with published financing",
    "need_evidence": "Official page confirms financing and publishes orders@drimmersUSA.com.",
    "commercial_angle": "Qualify whether it manages in-house receivables AnCar could improve.",
    "notes": "Financing appears partner-based; do not assume in-house credit."
  },
  {
    "company_name": "Kimbrell's Furniture & Appliances",
    "country": "United States",
    "city": "North Carolina / multiple locations",
    "business_type": "tienda_electrodomesticos_financia",
    "language": "en",
    "website": "https://www.kimbrells.com/ge",
    "email": "kimbrells@kimbrells.com",
    "email_verification": "published_public",
    "email_source": "https://www.kimbrells.com/ge",
    "financing_status": "verified",
    "financing_evidence": "Official page shows a credit application path and publishes the business email; current terms need review.",
    "source": "https://www.kimbrells.com/ge",
    "source_date": "2026-10-14",
    "score": 85,
    "status": "new",
    "intent_status": "medium",
    "need_signal": "Furniture and appliance retailer with credit application flow",
    "need_evidence": "Official page includes a credit application entry and published company email.",
    "commercial_angle": "Verify whether installments are managed internally before pitching.",
    "notes": "Public contact confirmed; current financing terms need follow-up verification."
  },
  {
    "company_name": "Appliances Club Austin",
    "country": "United States",
    "city": "Austin, Texas",
    "business_type": "tienda_electrodomesticos_financia",
    "language": "en",
    "website": "https://www.appliancesclub.com/financing",
    "email": "",
    "email_verification": "pending_review",
    "financing_status": "verified",
    "financing_evidence": "Official financing page lists store credit, Synchrony, Acima, American First Finance and lease-to-own options.",
    "source": "https://www.appliancesclub.com/financing",
    "source_date": "2026-10-14",
    "financing_method": "Third-party financing and lease-to-own",
    "store_count": 1,
    "score": 65,
    "status": "new",
    "intent_status": "high",
    "need_signal": "Appliance retailer offering multiple financing options",
    "need_evidence": "Official financing page lists multiple consumer financing providers.",
    "commercial_angle": "Find an official public sales email before outreach.",
    "notes": "No public email confirmed from the reviewed source."
  },
  {
    "company_name": "B&B Appliance & TV",
    "country": "United States",
    "city": "Cheyenne, Wyoming",
    "business_type": "tienda_electrodomesticos_financia",
    "language": "en",
    "website": "https://www.bappliance.com/financing",
    "email": "",
    "email_verification": "not_published",
    "financing_status": "verified",
    "financing_evidence": "Official financing page lists in-store financing, AVB credit card, Snap Finance and Synchrony.",
    "source": "https://www.bappliance.com/financing",
    "source_date": "2026-10-14",
    "financing_method": "Retail credit and lease-to-own",